{
  "schema": "hestia.asset-authoring.v1",
  "asset": {
    "assetId": "asset.minimal",
    "assetRevision": 0,
    "representation": "Solid",
    "metersPerUnit": 1,
    "coordinateFrame": {
      "upAxis": "+Y",
      "forwardAxis": "+Z",
      "handedness": "RIGHT"
    }
  },
  "parts": [],
  "joints": [],
  "markers": [],
  "materials": []
}
